{
    "$schema": "../../schema/system.schema.json",
    "name": "mira",
    "theme": "mira",
    "description": "Quiet · compact · precise: cool mist greys, 28px controls with 12px text, flat unshadowed surfaces and hairline rings instead of drop shadows.",
    "tagline": "Inter · 28px controls · hairline rings",
    "added": "2026-09-16T10:47:08+09:00",
    "forkedFrom": {
        "source": "foundation",
        "commit": "10f18da",
        "note": "Created by tooling/new-system from foundation on 2026-09-16, right after foundation was corrected against the mira reference app; the two are the same values."
    },
    "fonts": {
        "sans": "inter",
        "heading": "inherit",
        "mono": "system",
        "hangulFallback": "pretendard"
    },
    "icons": {
        "library": "hugeicons"
    },
    "defaultMode": "light",
    "tags": [
        "light",
        "dark",
        "mist",
        "compact",
        "shadcn-preset"
    ],
    "source": {
        "kind": "shadcn-preset",
        "note": "shadcn create preset base-mira (npx shadcn@4.21.0 init -t next -b base -p mira); values checked against the reference app with tooling/snapshot/compare-shadcn.mjs. foundation carries the same values, so this system is the user-facing copy of it.",
        "preset": "mira",
        "shadcnVersion": "4.21.0",
        "commit": "7c9eaba1c0a6404c990c144a654792e3313c650d"
    }
}
