{
    "$schema": "../../schema/system.schema.json",
    "name": "luma",
    "theme": "luma",
    "description": "Soft and generous: warm stone greys drawn with no borders at all — a tinted fill, a hairline ring and a real shadow — on 36px controls with 14px text and 26px-rounded cards and buttons.",
    "tagline": "Inter · borderless · 26px corners",
    "added": "2026-09-16T11:26:32+09:00",
    "forkedFrom": {
        "source": "foundation",
        "commit": "4b51482",
        "note": "Created by tooling/preset/port.mjs from foundation (mira values) and ported to the shadcn luma preset on 2026-09-16."
    },
    "fonts": {
        "sans": "inter",
        "heading": "inherit",
        "mono": "system",
        "hangulFallback": "pretendard"
    },
    "icons": {
        "library": "lucide"
    },
    "defaultMode": "light",
    "tags": [
        "light",
        "dark",
        "stone",
        "soft",
        "rounded",
        "shadcn-preset"
    ],
    "source": {
        "kind": "shadcn-preset",
        "note": "shadcn create preset base-luma (npx shadcn@4.21.0 init -t next -b base -p luma); values checked against the reference app with tooling/snapshot/compare-shadcn.mjs.",
        "preset": "luma",
        "shadcnVersion": "4.21.0",
        "commit": "7c9eaba1c0a6404c990c144a654792e3313c650d"
    }
}
