{
    "$schema": "../../schema/system.schema.json",
    "name": "vega",
    "theme": "vega",
    "description": "Calm · classic · comfortable: neutral greys, 36px controls with 14px text, a faint shadow-xs under outlined controls and 14px-rounded cards drawn with a hairline ring.",
    "tagline": "Inter · 36px controls · shadow-xs",
    "added": "2026-09-15T18:00:50+09:00",
    "forkedFrom": {
        "source": "foundation",
        "commit": "82c5ab1",
        "note": "Created by tooling/preset/port.mjs from foundation (mira values) and ported to the shadcn vega preset on 2026-09-15."
    },
    "fonts": {
        "sans": "inter",
        "heading": "inherit",
        "mono": "system",
        "hangulFallback": "pretendard"
    },
    "icons": {
        "library": "lucide"
    },
    "defaultMode": "light",
    "tags": [
        "light",
        "dark",
        "neutral",
        "comfortable",
        "shadcn-preset"
    ],
    "source": {
        "kind": "shadcn-preset",
        "note": "shadcn create preset base-vega (npx shadcn@4.21.0 init -t next -b base -p vega); values checked against the reference app with tooling/snapshot/compare-shadcn.mjs.",
        "preset": "vega",
        "shadcnVersion": "4.21.0",
        "commit": "7c9eaba1c0a6404c990c144a654792e3313c650d"
    }
}
