{
    "$schema": "../../schema/system.schema.json",
    "name": "nova",
    "theme": "nova",
    "description": "Geist on a zinc ramp: soft 10px corners, roomy 32px controls at 14px, and depth drawn with a hairline ring and a muted footer band.",
    "tagline": "Geist · 32px controls · 10px corners",
    "added": "2026-09-16T12:02:45+09:00",
    "forkedFrom": {
        "source": "foundation",
        "commit": "4b51482"
    },
    "fonts": {
        "sans": "geist",
        "heading": "inherit",
        "mono": "system",
        "hangulFallback": "pretendard"
    },
    "icons": {
        "library": "lucide"
    },
    "defaultMode": "light",
    "tags": [
        "shadcn-preset",
        "zinc",
        "light",
        "rounded"
    ],
    "source": {
        "kind": "shadcn-preset",
        "note": "shadcn create preset base-nova (npx shadcn@4.21.0 init -t next -b base -p nova); values checked against the reference app with tooling/snapshot/compare-shadcn.mjs.",
        "preset": "nova",
        "shadcnVersion": "4.21.0",
        "commit": "7c9eaba1c0a6404c990c144a654792e3313c650d"
    }
}
